{
  "$schema": "https://json-schema.org/draft/2020-12/schema",
  "$id": "urn:ashare:wave-e:SnapshotBPreflight:1.0.0",
  "title": "SnapshotBPreflight",
  "type": "object",
  "additionalProperties": false,
  "required": [
    "contract_name",
    "contract_version",
    "object_version",
    "object_id",
    "trace_id",
    "namespace",
    "symbols",
    "labels",
    "decision_cutoff",
    "retrieval_cutoff",
    "timezone",
    "source_identity",
    "rules_hash",
    "code_hash",
    "schema_hash",
    "predecessor_hash",
    "content_hash",
    "source_admission",
    "formal_source_admission",
    "reason_codes",
    "invalidation_conditions",
    "provider_identity_verified",
    "license_verified",
    "transport_integrity_verified",
    "historical_visibility_proven",
    "cloud_transfer",
    "tradeable",
    "production_eligible",
    "can_produce_order",
    "productionGate",
    "body"
  ],
  "properties": {
    "contract_name": {
      "const": "SnapshotBPreflight"
    },
    "contract_version": {
      "const": "1.0.0"
    },
    "object_version": {
      "const": 1
    },
    "object_id": {
      "type": "string",
      "pattern": "^wave-e:"
    },
    "trace_id": {
      "type": "string",
      "pattern": "^wave-e:"
    },
    "namespace": {
      "const": "LOCAL_ENGINE_DIAGNOSTIC:CORE_40"
    },
    "symbols": {
      "const": [
        "603993.SH",
        "600312.SH",
        "603228.SH"
      ]
    },
    "labels": {
      "const": [
        "NON_PIT_DIAGNOSTIC",
        "NOT_STRATEGY_EVIDENCE",
        "NON_TRADEABLE",
        "LOCAL_ONLY"
      ]
    },
    "decision_cutoff": {
      "type": "string",
      "format": "date-time"
    },
    "retrieval_cutoff": {
      "type": "string",
      "format": "date-time"
    },
    "timezone": {
      "const": "Asia/Shanghai"
    },
    "source_identity": {
      "type": "string",
      "pattern": "^sha256:[0-9a-f]{64}$"
    },
    "rules_hash": {
      "type": "string",
      "pattern": "^sha256:[0-9a-f]{64}$"
    },
    "code_hash": {
      "type": "string",
      "pattern": "^sha256:[0-9a-f]{64}$"
    },
    "schema_hash": {
      "type": "string",
      "pattern": "^sha256:[0-9a-f]{64}$"
    },
    "predecessor_hash": {
      "type": "string",
      "pattern": "^sha256:[0-9a-f]{64}$"
    },
    "content_hash": {
      "type": "string",
      "pattern": "^sha256:[0-9a-f]{64}$"
    },
    "source_admission": {
      "const": "UNVERIFIED_GATEWAY"
    },
    "formal_source_admission": {
      "const": "BLOCKED"
    },
    "reason_codes": {
      "type": "array",
      "minItems": 1,
      "uniqueItems": true,
      "items": {
        "enum": [
          "NON_PIT_DIAGNOSTIC",
          "NOT_STRATEGY_EVIDENCE",
          "NON_TRADEABLE",
          "LOCAL_ONLY",
          "UNVERIFIED_GATEWAY",
          "NO_HISTORICAL_PIT",
          "UNSET_REQUIRED",
          "UNKNOWN_STATUS",
          "NO_EXECUTION_AUTHORITY",
          "SEPARATE_OWNER_AUTHORIZATION_REQUIRED",
          "ACTUAL_FRESH_SESSION_REQUIRED",
          "REAL_FORWARD_NOT_AUTHORIZED",
          "NO_NATIVE_PROMOTION"
        ]
      }
    },
    "invalidation_conditions": {
      "const": [
        "PREDECESSOR_SOURCE_RAW_CHANGED",
        "RULE_CODE_SCHEMA_CHANGED",
        "CUTOFF_NAMESPACE_CHANGED",
        "PRIVATE_PATH_SUBSTITUTION",
        "CALLER_COPY_RESEAL",
        "AUTHORITY_PROMOTION"
      ]
    },
    "provider_identity_verified": {
      "const": false
    },
    "license_verified": {
      "const": false
    },
    "transport_integrity_verified": {
      "const": false
    },
    "historical_visibility_proven": {
      "const": false
    },
    "cloud_transfer": {
      "const": false
    },
    "tradeable": {
      "const": false
    },
    "production_eligible": {
      "const": false
    },
    "can_produce_order": {
      "const": false
    },
    "productionGate": {
      "const": false
    },
    "body": {
      "type": "object",
      "additionalProperties": false,
      "required": [
        "runner_ready",
        "actual_run_authorized",
        "actual_run_executed",
        "state",
        "actual_forward_days",
        "checks",
        "noncounted_days",
        "automatic_scheduling"
      ],
      "properties": {
        "runner_ready": {
          "const": true
        },
        "actual_run_authorized": {
          "const": false
        },
        "actual_run_executed": {
          "const": false
        },
        "state": {
          "const": "PENDING"
        },
        "actual_forward_days": {
          "const": 0
        },
        "checks": {
          "type": "array",
          "minItems": 10,
          "uniqueItems": true,
          "items": {
            "enum": [
              "SEPARATE_HUMAN_OWNER_AUTHORIZATION",
              "OFFICIAL_ACTUALLY_RESUMED_SESSION",
              "FRESH_SOURCE_DAY_AFTER_20260930",
              "ACTUAL_POST_MARKET_AVAILABILITY",
              "AVAILABLE_RETRIEVED_CUTOFF_ORDER",
              "EXACT_THREE_SYMBOLS",
              "SOURCE_RULE_CODE_SCHEMA_BINDINGS",
              "APPEND_NEW_ORIGINALS",
              "COMPARE_WITH_SNAPSHOT_A",
              "PROVIDER_LICENSE_POLICY_RECHECK"
            ]
          }
        },
        "noncounted_days": {
          "const": [
            "20261006",
            "20261007",
            "OLD_20260930_RETRIEVAL",
            "SYNTHETIC_FIXTURE",
            "HISTORICAL_REPLAY"
          ]
        },
        "automatic_scheduling": {
          "const": false
        }
      }
    }
  },
  "x-contract": {
    "version": "1.0.0",
    "required": "All listed fields; no optional extra fields",
    "enum": "Closed purpose/scope/state/reason registries",
    "unit": "Diagnostic DPU100 integer minor units; no actual CNY numeric parameters here",
    "money": "No binary floats; synthetic Decimal100 HALF_EVEN only in private diagnostic ledger",
    "timezone": "Explicit RFC3339 instant plus timezone Asia/Shanghai; DATE_ONLY is not instant",
    "hash_trace": "SHA256 source/rules/code/schema/predecessor/content plus object/trace/version",
    "invalidation": "Any source/version/cutoff/path/authority drift; display shape never issuance authority"
  }
}
