{"body":{"actual_forward_days":0,"actual_run_authorized":false,"actual_run_executed":false,"automatic_scheduling":false,"checks":["SEPARATE_HUMAN_OWNER_AUTHORIZATION","OFFICIAL_ACTUALLY_RESUMED_SESSION","FRESH_SOURCE_DAY_AFTER_20260930","ACTUAL_POST_MARKET_AVAILABILITY","AVAILABLE_RETRIEVED_CUTOFF_ORDER","EXACT_THREE_SYMBOLS","SOURCE_RULE_CODE_SCHEMA_BINDINGS","APPEND_NEW_ORIGINALS","COMPARE_WITH_SNAPSHOT_A","PROVIDER_LICENSE_POLICY_RECHECK"],"noncounted_days":["20261006","20261007","OLD_20260930_RETRIEVAL","SYNTHETIC_FIXTURE","HISTORICAL_REPLAY"],"runner_ready":true,"state":"PENDING"},"can_produce_order":false,"cloud_transfer":false,"code_hash":"sha256:ff38afe7f6833c723873426771a9f532bc867bae87c1af8de3581e2c2558a375","content_hash":"sha256:72c9efa63c4bb395b6617f3157c62a3f6f3d285acd7614e2e74809ddc190ce38","contract_name":"SnapshotBPreflight","contract_version":"1.0.0","decision_cutoff":"2026-10-06T12:37:32.209051Z","formal_source_admission":"BLOCKED","historical_visibility_proven":false,"invalidation_conditions":["PREDECESSOR_SOURCE_RAW_CHANGED","RULE_CODE_SCHEMA_CHANGED","CUTOFF_NAMESPACE_CHANGED","PRIVATE_PATH_SUBSTITUTION","CALLER_COPY_RESEAL","AUTHORITY_PROMOTION"],"labels":["NON_PIT_DIAGNOSTIC","NOT_STRATEGY_EVIDENCE","NON_TRADEABLE","LOCAL_ONLY"],"license_verified":false,"namespace":"LOCAL_ENGINE_DIAGNOSTIC:CORE_40","object_id":"wave-e:SnapshotBPreflight:0be239596f6af446","object_version":1,"predecessor_hash":"sha256:2e4a58f9eeea4a348cbb73b0d7ba4124b9a95a4b7e922919d254bcf35441c656","productionGate":false,"production_eligible":false,"provider_identity_verified":false,"reason_codes":["NON_PIT_DIAGNOSTIC","NOT_STRATEGY_EVIDENCE","NON_TRADEABLE","LOCAL_ONLY","UNVERIFIED_GATEWAY","NO_HISTORICAL_PIT","UNSET_REQUIRED","UNKNOWN_STATUS","NO_EXECUTION_AUTHORITY","SEPARATE_OWNER_AUTHORIZATION_REQUIRED","ACTUAL_FRESH_SESSION_REQUIRED","REAL_FORWARD_NOT_AUTHORIZED","NO_NATIVE_PROMOTION"],"retrieval_cutoff":"2026-10-06T12:24:18.256865Z","rules_hash":"sha256:6f3f491bca2f9de0ed7d9a47f94c8ab4ba9abe067e3a836189747202c8214869","schema_hash":"sha256:d4b10d9720519e4afaf8c3f2ca34f8891046e0cab1331c5602f4ce54c6967822","source_admission":"UNVERIFIED_GATEWAY","source_identity":"sha256:0be239596f6af446b75d7655a391575fe231da2b3863dc462c7ccb9f4a5d42e9","symbols":["603993.SH","600312.SH","603228.SH"],"timezone":"Asia/Shanghai","trace_id":"wave-e:0be239596f6af446b75d7655a391575fe231da2b3863dc462c7ccb9f4a5d42e9","tradeable":false,"transport_integrity_verified":false}
